Sheet: Sheet1
A1: X | B1: Y | R1: Iteration 1
A2: 2 | B2: 10 | R2: Itemset | S2: Support Count | T2: Pruned: | U2: Problem 4: Confidence
A3: 2 | B3: 5 | R3: Apple | S3: 0.6 | T3: (None)
A4: 8 | B4: 4 | R4: Banana | S4: 1
A5: 5 | B5: 8 | R5: Kiwi | S5: 0.8 | U5: Confidence(A, B) = P(A, B)/P(A)
A6: 7 | B6: 5 | R6: Milk | S6: 0.6
A7: 6 | B7: 4 | N7: X | O7: Y | P7: Euc | R7: Egg | S7: 0.4
A8: 1 | B8: 2 | N8: 8 | O8: 4 | P8: 7.2801098892805198
A9: 4 | B9: 9 | N9: 1 | O9: 2 | R9: Iteration 2 | U9: Confidence Calculations
R10: Itemset | S10: Support Count | T10: Pruned: | U10: A, B | V10: A -> B | W10: B -> A
A11: CiX | B11: CiY | D11: CiX | E11: CiY | G11: CiX | H11: 0 | R11: {Apple, Banana} | S11: 0.6 | T11: Apple, Egg | U11: {Apple, Banana} | V11: 1 | W11: 0.6
A12: 2 | B12: 10 | D12: 3 | E12: 9.5 | G12: 3.6666666666666701 | H12: 9 | R12: {Apple, Kiwi} | S12: 0.4 | T12: Kiwi, Egg | U12: {Apple, Kiwi} | V12: =(2/3) -> 0.66666666666666663 | W12: 0.5
A13: 5 | B13: 8 | D13: 6.5 | E13: 5.25 | G13: 7 | H13: 4.3333333333333304 | R13: {Apple, Milk} | S13: 0.4 | T13: Milk, Egg | U13: {Apple, Milk} | V13: =(2/3) -> 0.66666666666666663 | W13: =(2/3) -> 0.66666666666666663
A14: 1 | B14: 2 | D14: 1.5 | E14: 3.5 | G14: 1.5 | H14: 3.5 | R14: {Apple, Egg} | S14: 0.2 | U14: {Banana, Kiwi} | V14: 0.8 | W14: 1
R15: {Banana, Kiwi} | S15: 0.8 | U15: {Banana, Milk} | V15: 0.6 | W15: 1
A16: Centroid | D16: Centroid | G16: Centroid | K16: Single Link: | L16: 4 & 5 min | R16: {Banana, Milk} | S16: 0.6 | U16: {Banana, Egg} | V16: 0.4 | W16: 1
A17: 10.198039027185599 | D17: 9.9624294225856396 | G17: 9.7182531580755001 | K17: A | L17: A, B | M17: A, B, C | R17: {Banana, Egg} | S17: 0.4 | U17: {Kiwi, Milk} | V17: 0.5 | W17: =(2/3) -> 0.66666666666666663
A18: 9.4339811320565996 | D18: 8.3553874835341997 | G18: 8.2327260234856503 | K18: B | L18: C | R18: {Kiwi, Milk} | S18: 0.4
A19: 2.2360679774997898 | D19: 3.8078865529319499 | G19: 3.8078865529319499 | K19: C | R19: {Kiwi, Egg} | S19: 0.2
R20: {Milk, Egg} | S20: 0.2
A21: Distance | D21: Distance | G21: Distance | K21: Complete Link: | L21: B& C min of maxes
A22: Centroid 1 | B22: Centroid 2 | C22: Centroid 3 | D22: Centroid 1 | E22: Centroid 2 | F22: Centroid 3 | G22: Centroid 1 | H22: Centroid 2 | I22: Centroid 3 | K22: A | L22: A | M22: A, B, C | R22: Iteration 3 | U22: Confidence Calculations
A23: 0 | B23: 3.60555127546399 | C23: 8.0622577482985491 | D23: 1.1180339887499 | E23: 6.5431261641512002 | F23: 6.51920240520265 | G23: 1.9436506316151001 | H23: 7.55718936583642 | I23: 6.51920240520265 | K23: B | L23: B, C | R23: Itemset | S23: Support Count | T23: Pruned: | U23: A, B, C | V23: A, B -> C | W23: A, C -> B | X23: B, C -> A | Y23: A -> B, C | Z23: C -> A, B
A24: 5 | B24: 4.2426406871192901 | C24: 3.16227766016838 | D24: 4.60977222864644 | E24: 4.5069390943299901 | F24: 1.58113883008419 | G24: 4.3333333333333304 | H24: 5.0442486501405197 | I24: 1.58113883008419 | K24: C | R24: {Apple, Banana, Kiwi} | S24: 0.4 | T24: Apple, Kiwi, Milk | U24: {Apple, Banana, Kiwi} | V24: =(2/3) -> 0.66666666666666663 | W24: 1 | X24: - | Y24: =(2/3) -> 0.66666666666666663 | Z24: -
A25: 8.4852813742385695 | B25: 5 | C25: 7.2801098892805198 | D25: 7.4330343736592503 | E25: 1.9525624189766599 | F25: 6.51920240520265 | G25: 6.6164777470930698 | H25: 1.0540925533894601 | I25: 6.51920240520265 | R25: {Apple, Banana, Milk} | S25: 0.4 | U25: {Apple, Banana, Milk} | V25: =(2/3) -> 0.66666666666666663 | W25: 1 | X25: =(2/3) -> 0.66666666666666663 | Y25: =(2/3) -> 0.66666666666666663 | Z25: =(2/3) -> 0.66666666666666663
A26: 3.60555127546399 | B26: 0 | C26: 7.21110255092798 | D26: 2.5 | E26: 3.13249102153542 | F26: 5.7008771254956896 | G26: 1.6666666666666701 | H26: 4.1766546953805603 | I26: 5.7008771254956896 | R26: {Banana, Kiwi, Milk} | S26: 0.4 | U26: {Banana, Kiwi, Milk} | V26: - | W26: =(2/3) -> 0.66666666666666663 | X26: 1 | Y26: - | Z26: =(2/3) -> 0.66666666666666663
A27: 7.0710678118654799 | B27: 3.60555127546399 | C27: 6.7082039324993703 | D27: 6.0207972893961497 | E27: 0.55901699437494701 | F27: 5.7008771254956896 | G27: 5.2068331172711 | H27: 0.66666666666666696 | I27: 5.7008771254956896 | R27: {Apple, Kiwi, Milk} | S27: 0.2
A28: 7.21110255092798 | B28: 4.1231056256176597 | C28: 5.3851648071345002 | D28: 6.2649820430708303 | E28: 1.3462912017836299 | F28: 4.5276925690687104 | G28: 5.51764845241562 | H28: 1.0540925533894601 | I28: 4.5276925690687104
A29: 8.0622577482985491 | B29: 7.21110255092798 | C29: 0 | D29: 7.7620873481300103 | E29: 6.3884661695903198 | F29: 1.58113883008419 | G29: 7.4907350180814101 | H29: 6.4377359719426597 | I29: 1.58113883008419 | R29: Iteration 4:
A30: 10.198039027185599 | B30: 1.4142135623731 | C30: 7.6157731058639104 | D30: 1.1180339887499 | E30: 4.5069390943299901 | F30: 6.0415229867972897 | G30: 0.33333333333333298 | H30: 5.5477723256977498 | I30: 6.0415229867972897 | R30: Itemset | S30: Support Count | T30: Pruned:
A31: Minimum Distance | D31: Minimum Distance | G31: Minimum Distance | R31: (None) | S31: - | T31: (None)
A32: 1 | D32: 1 | G32: 1
C33: 2 | F33: 2 | I33: 2
B34: 3 | E34: 3 | H34: 3
B35: 4 | D35: 4 | G35: 4
B36: 5 | E36: 5 | H36: 5
B37: 6 | E37: 6 | H37: 6
C38: 7 | F38: 7 | I38: 7
A39: 8 | D39: 8 | G39: 8